{
  "schema_version": "1.0.0",
  "artifact_id": "VAIXLNS.SYSTEM_LANGUAGE_FABRIC.V1",
  "status": "PROPOSAL",
  "canonical_authority": "VAIXLNS",
  "orchestrator": "VX",
  "assurance_gate": "ARC-X",
  "canonical_source_rule": "project.genome::v1.0.0 remains the Golden Source. This registry is a proposal and must not redefine canon. Every reference outside this repository remains unverified until fetched, hashed, and admitted.",
  "policy": {
    "default_mode": "READ_ONLY",
    "unknown_language_action": "HOLD",
    "missing_parser_action": "HOLD_ADAPTER_NOT_CONFIGURED",
    "missing_semantics_or_compiler_action": "HOLD",
    "execute_source_code": false,
    "network_access": false,
    "canonical_mutation": false,
    "delete_or_overwrite_historical_artifacts": false,
    "require_source_hash": true,
    "require_reproducible_tests_before_verified": true,
    "preserve_original_derived_superseded_active_lineage": true
  },
  "languages": [
    {
      "language_id": "vaixl.project-genome",
      "version": "1.0.0",
      "display_name": "VAIXLNS Project Genome",
      "grammar": "unresolved",
      "source_status": "PROPOSAL",
      "canonical_ref": "project.genome::v1.0.0",
      "reference_state": "UNVERIFIED_EXTERNAL_CANON_REFERENCE",
      "parser_adapter": null,
      "semantic_adapter": null,
      "compiler_adapter": null,
      "required_root_keys": [],
      "capabilities": [
        "identity_resolution",
        "canonical_provenance"
      ],
      "allowed_targets": [],
      "notes": "Golden Source identity is recorded as a reference only; its actual bytes and grammar are not available to this adapter."
    },
    {
      "language_id": "vx.intent-json",
      "version": "1.0.0",
      "display_name": "VX Intent Envelope (proposed)",
      "grammar": "json",
      "source_status": "PROPOSAL",
      "canonical_ref": "project.genome#languages/vx.intent-json",
      "reference_state": "PROPOSED_CANONICAL_ANCHOR",
      "parser_adapter": "builtin.json.v1",
      "semantic_adapter": null,
      "compiler_adapter": null,
      "required_root_keys": [
        "intent_id",
        "goal"
      ],
      "capabilities": [
        "syntax_parse",
        "structural_check",
        "source_hash"
      ],
      "allowed_targets": [
        "vx.agent-contract-python"
      ],
      "notes": "The required fields are a candidate contract, not an assertion about an already-adopted VX grammar."
    },
    {
      "language_id": "vx.agent-contract-python",
      "version": "1.0.0",
      "display_name": "VX Agent Contract Python AST",
      "grammar": "python_ast",
      "source_status": "PARTIAL",
      "canonical_ref": "src/vx_agents_fabric/contracts.py",
      "reference_state": "REPOSITORY_FILE_REFERENCE",
      "parser_adapter": "builtin.python-ast.v1",
      "semantic_adapter": null,
      "compiler_adapter": null,
      "required_root_keys": [],
      "capabilities": [
        "syntax_parse",
        "static_structure_summary",
        "source_hash"
      ],
      "allowed_targets": [
        "vx.intent-json"
      ],
      "notes": "Python is parsed into an AST only. No imports, calls, file effects or code execution occur."
    },
    {
      "language_id": "vx.integration-attestation-json",
      "version": "1.0.0",
      "display_name": "VX Integration Attestation Envelope",
      "grammar": "json",
      "source_status": "SPECIFIED",
      "canonical_ref": "docs/integration/PROMPT_OFFICE_RUNTIME_PREFLIGHT_V1.md",
      "reference_state": "REPOSITORY_DOCUMENT_REFERENCE",
      "parser_adapter": "builtin.json.v1",
      "semantic_adapter": null,
      "compiler_adapter": null,
      "required_root_keys": [
        "schema_version",
        "provider_id",
        "integration_type",
        "observed_at",
        "expires_at",
        "probe_result",
        "capabilities",
        "evidence"
      ],
      "capabilities": [
        "syntax_parse",
        "structural_check",
        "source_hash"
      ],
      "allowed_targets": [],
      "notes": "JSON shape checks do not verify HMACs, timestamps, provider reachability, or the honesty of a trusted host probe."
    },
    {
      "language_id": "omega.math-expression",
      "version": "1.0.0",
      "display_name": "Bounded Omega Math Expression",
      "grammar": "math_expression",
      "source_status": "PARTIAL",
      "canonical_ref": "src/vx_agents_fabric/engineering_tools.py",
      "reference_state": "REPOSITORY_FILE_REFERENCE",
      "parser_adapter": "builtin.math-expression.v1",
      "semantic_adapter": null,
      "compiler_adapter": null,
      "required_root_keys": [],
      "capabilities": [
        "safe_syntax_parse",
        "operator_allowlist",
        "source_hash"
      ],
      "allowed_targets": [],
      "notes": "Only a bounded math-expression syntax is recognized. This adapter does not calculate results or replace the existing engineering tool implementation."
    },
    {
      "language_id": "vsm.protocol-markdown",
      "version": "1.0.0",
      "display_name": "VSM Protocol Description",
      "grammar": "markdown",
      "source_status": "PROPOSAL",
      "canonical_ref": "project.genome#languages/vsm.protocol-markdown",
      "reference_state": "PROPOSED_CANONICAL_ANCHOR",
      "parser_adapter": null,
      "semantic_adapter": null,
      "compiler_adapter": null,
      "required_root_keys": [],
      "capabilities": [
        "protocol_description",
        "stage_contracts",
        "provenance"
      ],
      "allowed_targets": [
        "vx.intent-json"
      ],
      "notes": "A protocol description is not executable semantics; a Markdown parser and formal protocol schema remain unconfigured."
    },
    {
      "language_id": "vx.schema-yaml",
      "version": "1.0.0",
      "display_name": "VX YAML Schema Surface",
      "grammar": "yaml",
      "source_status": "PROPOSAL",
      "canonical_ref": "project.genome#languages/vx.schema-yaml",
      "reference_state": "PROPOSED_CANONICAL_ANCHOR",
      "parser_adapter": null,
      "semantic_adapter": null,
      "compiler_adapter": null,
      "required_root_keys": [],
      "capabilities": [
        "schema_declaration",
        "contract_validation"
      ],
      "allowed_targets": [],
      "notes": "A YAML parser/schema validator is intentionally not implied by this registry. Add a pinned, reviewed adapter before parsing YAML."
    },
    {
      "language_id": "NXL-S",
      "version": "1.0.0",
      "display_name": "NXL Symbol Surface",
      "grammar": "unresolved",
      "source_status": "PROPOSAL",
      "canonical_ref": "docs/integration/OMEGA_SYMBOL_FABRIC_V1.md#NXL-S",
      "reference_state": "REPOSITORY_PROPOSAL",
      "parser_adapter": null,
      "semantic_adapter": null,
      "compiler_adapter": null,
      "required_root_keys": [],
      "capabilities": [
        "candidate_symbol_crosswalk"
      ],
      "allowed_targets": [],
      "notes": "Recovered language identity only. The original grammar, semantics, and compiler are not mounted; symbol translation must return HOLD."
    },
    {
      "language_id": "NXL-SYS",
      "version": "1.0.0",
      "display_name": "NXL System Contract",
      "grammar": "unresolved",
      "source_status": "PROPOSAL",
      "canonical_ref": "docs/integration/OMEGA_SYMBOL_FABRIC_V1.md#NXL-SYS",
      "reference_state": "REPOSITORY_PROPOSAL",
      "parser_adapter": null,
      "semantic_adapter": null,
      "compiler_adapter": null,
      "required_root_keys": [],
      "capabilities": [
        "candidate_symbol_crosswalk"
      ],
      "allowed_targets": [],
      "notes": "Recovered language identity only. The original grammar, semantics, and compiler are not mounted; symbol translation must return HOLD."
    },
    {
      "language_id": "NXL-ARCH",
      "version": "1.0.0",
      "display_name": "NXL Architecture",
      "grammar": "unresolved",
      "source_status": "PROPOSAL",
      "canonical_ref": "docs/integration/OMEGA_SYMBOL_FABRIC_V1.md#NXL-ARCH",
      "reference_state": "REPOSITORY_PROPOSAL",
      "parser_adapter": null,
      "semantic_adapter": null,
      "compiler_adapter": null,
      "required_root_keys": [],
      "capabilities": [
        "candidate_symbol_crosswalk"
      ],
      "allowed_targets": [],
      "notes": "Recovered language identity only. The original grammar, semantics, and compiler are not mounted; symbol translation must return HOLD."
    },
    {
      "language_id": "NXL-CON",
      "version": "1.0.0",
      "display_name": "NXL Constraints",
      "grammar": "unresolved",
      "source_status": "PROPOSAL",
      "canonical_ref": "docs/integration/OMEGA_SYMBOL_FABRIC_V1.md#NXL-CON",
      "reference_state": "REPOSITORY_PROPOSAL",
      "parser_adapter": null,
      "semantic_adapter": null,
      "compiler_adapter": null,
      "required_root_keys": [],
      "capabilities": [
        "candidate_symbol_crosswalk"
      ],
      "allowed_targets": [],
      "notes": "Recovered language identity only. The original grammar, semantics, and compiler are not mounted; symbol translation must return HOLD."
    },
    {
      "language_id": "NXL-PROOF",
      "version": "1.0.0",
      "display_name": "NXL Proof",
      "grammar": "unresolved",
      "source_status": "PROPOSAL",
      "canonical_ref": "docs/integration/OMEGA_SYMBOL_FABRIC_V1.md#NXL-PROOF",
      "reference_state": "REPOSITORY_PROPOSAL",
      "parser_adapter": null,
      "semantic_adapter": null,
      "compiler_adapter": null,
      "required_root_keys": [],
      "capabilities": [
        "candidate_symbol_crosswalk"
      ],
      "allowed_targets": [],
      "notes": "Recovered language identity only. The original grammar, semantics, and compiler are not mounted; symbol translation must return HOLD."
    },
    {
      "language_id": "NXL-EXEC",
      "version": "1.0.0",
      "display_name": "NXL Execution Contract",
      "grammar": "unresolved",
      "source_status": "PROPOSAL",